{"$schema":"https://json-schema.org/draft/2020-12/schema","additionalProperties":false,"description":"Blinded source-boundary review packet containing only authorized source material and candidate editorial copy. Strictly excludes verifier predictions, model risk scores, prior human decisions, repair history, and cohort quota tracking.","properties":{"acceptedSemanticClassification":{"additionalProperties":false,"properties":{"attentionDemand":{"type":["string","null"]},"discoveryStyle":{"type":["string","null"]},"emotionalWeight":{"type":["string","null"]},"filterLanguages":{"items":{"type":"string"},"type":"array"},"moods":{"items":{"type":"string"},"type":"array"},"pace":{"type":["string","null"]},"situations":{"items":{"type":"string"},"type":"array"}},"type":"object"},"allowedSourceMaterial":{"additionalProperties":false,"properties":{"keywords":{"items":{"type":"string"},"type":"array"},"overview":{"type":["string","null"]}},"required":["overview"],"type":"object"},"candidateId":{"pattern":"^(scale500|exp100)-tmdb-[0-9]+$","type":"string"},"copyConstraints":{"additionalProperties":false,"properties":{"curiosityHook":{"additionalProperties":false,"properties":{"maxChars":{"type":["integer","null"]},"minChars":{"type":["integer","null"]}},"type":"object"},"description":{"additionalProperties":false,"properties":{"maxChars":{"type":["integer","null"]},"minChars":{"type":["integer","null"]}},"type":"object"},"vibeSummary":{"additionalProperties":false,"properties":{"maxChars":{"type":["integer","null"]},"minChars":{"type":["integer","null"]}},"type":"object"},"whyWatch":{"additionalProperties":false,"properties":{"maxChars":{"type":["integer","null"]},"minChars":{"type":["integer","null"]}},"type":"object"}},"type":["object","null"]},"facts":{"additionalProperties":false,"properties":{"countries":{"items":{"type":"string"},"type":"array"},"director":{"type":["string","null"]},"genres":{"items":{"type":"string"},"type":"array"},"keywords":{"items":{"type":"string"},"type":"array"},"overview":{"type":["string","null"]},"posterPath":{"type":["string","null"]},"runtimeMinutes":{"type":["integer","null"]},"spokenLanguages":{"items":{"type":"string"},"type":"array"},"title":{"type":"string"},"year":{"type":["integer","null"]}},"required":["title","year","director","genres","countries","spokenLanguages","runtimeMinutes","overview"],"type":"object"},"semanticBoundaryRules":{"additionalProperties":false,"properties":{},"type":["object","null"]},"sourcePacketHash":{"pattern":"^sha256:[a-f0-9]{64}$","type":"string"},"spoilerBoundaryRules":{"additionalProperties":false,"properties":{"allowed":{"items":{"type":"string"},"type":"array"},"excluded":{"items":{"type":"string"},"type":"array"}},"type":["object","null"]},"visibleEditorialCopy":{"additionalProperties":false,"properties":{"curiosityHook":{"type":"string"},"description":{"type":"string"},"vibeSummary":{"type":"string"},"whyWatch":{"type":"string"}},"required":["description","whyWatch","curiosityHook","vibeSummary"],"type":"object"}},"required":["candidateId","facts","allowedSourceMaterial","acceptedSemanticClassification","visibleEditorialCopy","sourcePacketHash"],"title":"BlindHumanReviewPacketV1","type":"object"}
