{"acceptedSemanticClassification":{"attentionDemand":"engaged","discoveryStyle":"adventurous","emotionalWeight":"moderate","filterLanguages":["English","French"],"moods":["exciting","emotional"],"pace":"fast","situations":["family"]},"allowedSourceMaterial":{"keywords":[],"overview":"After a guardian of magical jewels turns an awkward girl and a popular boy into superheroes, they can never reveal their identities — even to each other."},"candidateId":"exp100-tmdb-496450","copyConstraints":{"curiosityHook":{"maxChars":170,"minChars":50},"description":{"maxChars":220,"minChars":80},"vibeSummary":{"maxChars":150,"minChars":45},"whyWatch":{"maxChars":180,"minChars":60}},"facts":{"countries":["Canada","China","France"],"director":"Jeremy Zag","genres":["Action","Animation","Family","Fantasy","Romance"],"keywords":["3d animation","based on tv series","butterfly","magic","musical","paris, france","superhero","teenager"],"overview":"After a guardian of magical jewels turns an awkward girl and a popular boy into superheroes, they can never reveal their identities — even to each other.","posterPath":"/dQNJ8SdCMn3zWwHzzQD2xrphR1X.jpg","runtimeMinutes":105,"spokenLanguages":["English","French"],"title":"Miraculous: Ladybug & Cat Noir, The Movie","year":2023},"sourcePacketHash":"sha256:a72aef180fcf65250a0de508516e114dea6c60c16fe38f13d951c0f913af5322","spoilerBoundaryRules":{"allowed":["characters or central subjects","starting situation","premise","initial conflict","tone","texture","viewing experience"],"excluded":["major reversals","hidden identities","later deaths","culprit information","late relationship outcomes","third-act events","endings","later revelations"]},"visibleEditorialCopy":{"curiosityHook":"Can two young heroes pull off world-saving teamwork when their own sworn secrecy keeps them entirely in the dark?","description":"When a guardian of magical jewels grants superpowers to an awkward girl and a popular boy, the pair must defend Paris under a strict condition: neither can ever discover who the other really is.","vibeSummary":"Fast, colorful family fantasy packed with exciting superhero action and engaging romantic tension.","whyWatch":"Jeremy Zag delivers a brisk animated fantasy balancing kinetic superhero spectacle with the romantic friction of two partners concealing their true selves."}}
