{"acceptedSemanticClassification":{"attentionDemand":"easy","discoveryStyle":"familiar","emotionalWeight":"light","filterLanguages":["English"],"moods":["funny","suspenseful"],"pace":"medium","situations":["family","easy-watch"]},"allowedSourceMaterial":{"keywords":[],"overview":"Scooby-Doo and his pals win an all-expense paid vacation and embark on a trip of a lifetime to a tropical paradise. Their destination however, turns out to be Zombie Island. As soon as they arrive, they realize the place looks strangely familiar and is reminiscent of a trip they took years ago, in which they became wrapped up in a mystery involving zombies. The gang soon learns that their trip to paradise comes with a price when the zombies re-emerge and attack their hotel. Will Scooby-Doo and the Mystery Inc. gang finally solve the mystery behind Zombie Island?"},"candidateId":"scale500-tmdb-615774","copyConstraints":{"curiosityHook":{"maxChars":170,"minChars":50},"description":{"maxChars":220,"minChars":80},"vibeSummary":{"maxChars":150,"minChars":45},"whyWatch":{"maxChars":180,"minChars":60}},"facts":{"countries":["United States of America"],"director":"Cecilia Aranovich & Ethan Spaulding","genres":["Adventure","Animation","Comedy","Family","Fantasy","Horror","Mystery"],"keywords":["cartoon","cartoon dog","talking dog","zombie"],"overview":"Scooby-Doo and his pals win an all-expense paid vacation and embark on a trip of a lifetime to a tropical paradise. Their destination however, turns out to be Zombie Island. As soon as they arrive, they realize the place looks strangely familiar and is reminiscent of a trip they took years ago, in which they became wrapped up in a mystery involving zombies. The gang soon learns that their trip to paradise comes with a price when the zombies re-emerge and attack their hotel. Will Scooby-Doo and the Mystery Inc. gang finally solve the mystery behind Zombie Island?","posterPath":"/vd0oIoWhEm8o7EpS0kV7RaV0Flf.jpg","runtimeMinutes":80,"spokenLanguages":["English"],"title":"Scooby-Doo! Return to Zombie Island","year":2019},"sourcePacketHash":"sha256:3b3987145f73fb146770bded7e198728578d74bfa8f8c0dca4662e9406e607d2","spoilerBoundaryRules":{"allowed":["characters or central subjects","starting situation","premise","initial conflict","tone","texture","viewing experience"],"excluded":["major reversals","hidden identities","later deaths","culprit information","late relationship outcomes","third-act events","endings","later revelations"]},"visibleEditorialCopy":{"curiosityHook":"What connects this seemingly random prize getaway to the gang's prior brush with the undead?","description":"After winning an all-expense-paid tropical vacation, Scooby-Doo and the Mystery Inc. gang arrive at a resort that looks disturbingly familiar. When zombies storm their hotel, an old nightmare resurfaces.","vibeSummary":"Lighthearted, mildly spooky, and fast-moving, it offers an easygoing animated watch built for family night.","whyWatch":"Clocking in at a breezy 80 minutes, it mixes playful comedy with lively cartoon suspense, delivering a comfortable, retro mystery tailored for low-stress family viewing."}}
