{"acceptedSemanticClassification":{"attentionDemand":"immersive","discoveryStyle":"different","emotionalWeight":"heavy","filterLanguages":["Japanese"],"moods":["exciting","emotional","suspenseful"],"pace":"fast","situations":["alone"]},"allowedSourceMaterial":{"keywords":[],"overview":"Fourteen years after Third Impact, Shinji Ikari awakens to a world he does not remember. He hasn't aged. Much of Earth is laid in ruins, NERV has been dismantled, and people who he once protected have turned against him. Befriending the enigmatic Kaworu Nagisa, Shinji continues the fight against the angels and realizes the fighting is far from over, even when it could be against his former allies. The characters' struggles continue amidst the battles against the angels and each other, spiraling down to what could inevitably be the end of the world."},"candidateId":"scale500-tmdb-75629","copyConstraints":{"curiosityHook":{"maxChars":170,"minChars":50},"description":{"maxChars":220,"minChars":80},"vibeSummary":{"maxChars":150,"minChars":45},"whyWatch":{"maxChars":180,"minChars":60}},"facts":{"countries":["Japan"],"director":"Hideaki Anno & Kazuya Tsurumaki & Masayuki & Mahiro Maeda","genres":["Action","Animation","Drama","Science Fiction"],"keywords":["alien","anime","based on tv series","boys' love (bl)","complex","depression","doubtful","father son conflict","gay love","gay romance","gay theme","giant robot","lgbt","mecha","military","philosophical","post-apocalyptic future","queer","sacrifice","surreal","time skip"],"overview":"Fourteen years after Third Impact, Shinji Ikari awakens to a world he does not remember. He hasn't aged. Much of Earth is laid in ruins, NERV has been dismantled, and people who he once protected have turned against him. Befriending the enigmatic Kaworu Nagisa, Shinji continues the fight against the angels and realizes the fighting is far from over, even when it could be against his former allies. The characters' struggles continue amidst the battles against the angels and each other, spiraling down to what could inevitably be the end of the world.","posterPath":"/d0s1xvykzl0kz7fP5S2ROYqphdz.jpg","runtimeMinutes":96,"spokenLanguages":["Japanese"],"title":"Evangelion: 3.0 You Can (Not) Redo","year":2012},"sourcePacketHash":"sha256:0460ce652af3f2e8c90ec2ef52263998a4d1f06b4aaebadcc6e306251ce22b15","spoilerBoundaryRules":{"allowed":["characters or central subjects","starting situation","premise","initial conflict","tone","texture","viewing experience"],"excluded":["major reversals","hidden identities","later deaths","culprit information","late relationship outcomes","third-act events","endings","later revelations"]},"visibleEditorialCopy":{"curiosityHook":"Awakening into a ruined future where your friends are now foes, whom can you trust when the next clash could end everything?","description":"Fourteen years after Third Impact, Shinji Ikari awakens unaged in a devastated world where NERV is dismantled, his former allies have turned hostile, and he must navigate a new battle alongside the enigmatic Kaworu.","vibeSummary":"Immersive and heavy sci-fi action filled with dread, suspenseful escalations, and brisk, concentrated apocalyptic conflict.","whyWatch":"A fast-moving, emotionally heavy sci-fi drama that plunges into apocalyptic dread, pitting former comrades against each other in intense, high-stakes animated warfare."}}
