{"acceptedSemanticClassification":{"attentionDemand":"engaged","discoveryStyle":"different","emotionalWeight":"heavy","filterLanguages":["German"],"moods":["suspenseful"],"pace":"medium","situations":["alone"]},"allowedSourceMaterial":{"keywords":[],"overview":"A killer is released from prison and breaks into a remote home to kill a woman, her handicapped son and her pretty daughter."},"candidateId":"scale500-tmdb-18912","copyConstraints":{"curiosityHook":{"maxChars":170,"minChars":50},"description":{"maxChars":220,"minChars":80},"vibeSummary":{"maxChars":150,"minChars":45},"whyWatch":{"maxChars":180,"minChars":60}},"facts":{"countries":["Austria"],"director":"Gerald Kargl","genres":["Crime","Horror","Thriller"],"keywords":["bodily disabled person","character study","emotionally disturbed","german-german border","home invasion","knife","madman","maniac","mental breakdown","mental illness","narration","prison","psychopath","schizophrenia","serial killer","sociopath","stalker"],"overview":"A killer is released from prison and breaks into a remote home to kill a woman, her handicapped son and her pretty daughter.","posterPath":"/nSYdWrPPwvcs5t5hG67XqDbwncG.jpg","runtimeMinutes":75,"spokenLanguages":["German"],"title":"Angst","year":1983},"sourcePacketHash":"sha256:51f1ba88fb7044654e70885086eccad5ff22c39ac232bf58501571ab7fdb5025","spoilerBoundaryRules":{"allowed":["characters or central subjects","starting situation","premise","initial conflict","tone","texture","viewing experience"],"excluded":["major reversals","hidden identities","later deaths","culprit information","late relationship outcomes","third-act events","endings","later revelations"]},"visibleEditorialCopy":{"curiosityHook":"Once the killer crosses the threshold into the secluded house, the family's fight to survive within their own walls turns immediate and merciless.","description":"Freshly released from prison, a killer invades an isolated home where a woman, her daughter, and her disabled son are trapped inside. Gerald Kargl directs this taut 1983 Austrian crime thriller.","vibeSummary":"Heavy, suspenseful, and deeply unsettling. An uncompromising 75-minute watch best experienced alone.","whyWatch":"At a compressed 75 minutes, Gerald Kargl delivers an intensely focused, heavy-hitting Austrian horror thriller that wastes no time locking into high-stakes dread."}}
